{"format":"ena3d-exchange","version":1,"dimensions":["MR1","SVD2","SVD3","SVD4","SVD5"],"group_variables":["groupid"],"tables":{"meta_data":{"columns":[{"name":"ENA_UNIT","type":"character","values":["group_1_unit_a","group_1_unit_b","group_2_unit_a","group_2_unit_b"]},{"name":"groupid","type":"double","values":[1,1,2,2]},{"name":"username","type":"character","values":["unit_a","unit_b","unit_a","unit_b"]}]},"points":{"columns":[{"name":"ENA_UNIT","type":"character","values":["group_1_unit_a","group_1_unit_b","group_2_unit_a","group_2_unit_b"]},{"name":"groupid","type":"double","values":[1,1,2,2]},{"name":"username","type":"character","values":["unit_a","unit_b","unit_a","unit_b"]},{"name":"MR1","type":"double","values":[-0.325710544951321,-0.599640683468784,0.489345187573435,0.43600604084667]},{"name":"SVD2","type":"double","values":[-0.216594415527486,0.216594415527486,0.691208201470842,-0.691208201470842]},{"name":"SVD3","type":"double","values":[0.468147078928503,-0.468147078928503,0.146696816857281,-0.146696816857281]},{"name":"SVD4","type":"double","values":[5.89805981832114e-17,-6.93889390390723e-18,2.37657116208823e-16,-2.37657116208823e-16]},{"name":"SVD5","type":"double","values":[1.47451495458029e-17,6.93889390390723e-17,-2.12503625807159e-16,1.4137996329211e-16]}]},"line_weights":{"columns":[{"name":"ENA_UNIT","type":"character","values":["group_1_unit_a","group_1_unit_b","group_2_unit_a","group_2_unit_b"]},{"name":"groupid","type":"double","values":[1,1,2,2]},{"name":"username","type":"character","values":["unit_a","unit_b","unit_a","unit_b"]},{"name":"Q1 & Q2","type":"double","values":[0.166666666666667,0.258198889747161,0.408248290463863,0]},{"name":"Q1 & Q3","type":"double","values":[0,0,0.408248290463863,0]},{"name":"Q2 & Q3","type":"double","values":[0,0,0.408248290463863,0]},{"name":"Q1 & R1","type":"double","values":[0.166666666666667,0.258198889747161,0,0]},{"name":"Q2 & R1","type":"double","values":[0.166666666666667,0.258198889747161,0,0]},{"name":"Q3 & R1","type":"double","values":[0,0,0,0]},{"name":"Q1 & R2","type":"double","values":[0,0,0,0]},{"name":"Q2 & R2","type":"double","values":[0,0,0,0]},{"name":"Q3 & R2","type":"double","values":[0,0,0,0]},{"name":"R1 & R2","type":"double","values":[0,0,0,0]},{"name":"Q1 & R3","type":"double","values":[0.166666666666667,0,0,0]},{"name":"Q2 & R3","type":"double","values":[0.166666666666667,0,0,0]},{"name":"Q3 & R3","type":"double","values":[0,0,0,0]},{"name":"R1 & R3","type":"double","values":[0.166666666666667,0,0,0]},{"name":"R2 & R3","type":"double","values":[0,0,0,0]},{"name":"Q1 & S1","type":"double","values":[0.166666666666667,0.258198889747161,0,0]},{"name":"Q2 & S1","type":"double","values":[0.166666666666667,0.258198889747161,0,0]},{"name":"Q3 & S1","type":"double","values":[0,0,0,0]},{"name":"R1 & S1","type":"double","values":[0.166666666666667,0.258198889747161,0,0]},{"name":"R2 & S1","type":"double","values":[0,0,0,0]},{"name":"R3 & S1","type":"double","values":[0.166666666666667,0,0,0]},{"name":"Q1 & S2","type":"double","values":[0.166666666666667,0,0.408248290463863,0]},{"name":"Q2 & S2","type":"double","values":[0.166666666666667,0,0.408248290463863,0]},{"name":"Q3 & S2","type":"double","values":[0,0,0.408248290463863,0]},{"name":"R1 & S2","type":"double","values":[0.166666666666667,0,0,0]},{"name":"R2 & S2","type":"double","values":[0,0,0,0]},{"name":"R3 & S2","type":"double","values":[0.166666666666667,0,0,0]},{"name":"S1 & S2","type":"double","values":[0.166666666666667,0,0,0.408248290463863]},{"name":"Q1 & S3","type":"double","values":[0.166666666666667,0.258198889747161,0,0]},{"name":"Q2 & S3","type":"double","values":[0.166666666666667,0.258198889747161,0,0]},{"name":"Q3 & S3","type":"double","values":[0,0,0,0]},{"name":"R1 & S3","type":"double","values":[0.166666666666667,0.258198889747161,0,0]},{"name":"R2 & S3","type":"double","values":[0,0,0,0]},{"name":"R3 & S3","type":"double","values":[0.166666666666667,0,0,0]},{"name":"S1 & S3","type":"double","values":[0.166666666666667,0.258198889747161,0,0]},{"name":"S2 & S3","type":"double","values":[0.166666666666667,0,0,0]},{"name":"Q1 & C1","type":"double","values":[0.166666666666667,0,0,0]},{"name":"Q2 & C1","type":"double","values":[0.166666666666667,0,0,0]},{"name":"Q3 & C1","type":"double","values":[0,0,0,0]},{"name":"R1 & C1","type":"double","values":[0.166666666666667,0,0,0]},{"name":"R2 & C1","type":"double","values":[0,0,0,0]},{"name":"R3 & C1","type":"double","values":[0.166666666666667,0,0,0]},{"name":"S1 & C1","type":"double","values":[0.166666666666667,0,0,0.408248290463863]},{"name":"S2 & C1","type":"double","values":[0.166666666666667,0,0,0.408248290463863]},{"name":"S3 & C1","type":"double","values":[0.166666666666667,0,0,0]},{"name":"Q1 & C2","type":"double","values":[0.166666666666667,0,0,0]},{"name":"Q2 & C2","type":"double","values":[0.166666666666667,0,0,0]},{"name":"Q3 & C2","type":"double","values":[0,0,0,0]},{"name":"R1 & C2","type":"double","values":[0.166666666666667,0,0,0]},{"name":"R2 & C2","type":"double","values":[0,0,0,0]},{"name":"R3 & C2","type":"double","values":[0.166666666666667,0,0,0]},{"name":"S1 & C2","type":"double","values":[0.166666666666667,0,0,0.408248290463863]},{"name":"S2 & C2","type":"double","values":[0.166666666666667,0,0,0.408248290463863]},{"name":"S3 & C2","type":"double","values":[0.166666666666667,0,0,0]},{"name":"C1 & C2","type":"double","values":[0.166666666666667,0,0,0.408248290463863]},{"name":"Q1 & C3","type":"double","values":[0,0.258198889747161,0,0]},{"name":"Q2 & C3","type":"double","values":[0,0.258198889747161,0,0]},{"name":"Q3 & C3","type":"double","values":[0,0,0,0]},{"name":"R1 & C3","type":"double","values":[0,0.258198889747161,0,0]},{"name":"R2 & C3","type":"double","values":[0,0,0,0]},{"name":"R3 & C3","type":"double","values":[0,0,0,0]},{"name":"S1 & C3","type":"double","values":[0,0.258198889747161,0,0]},{"name":"S2 & C3","type":"double","values":[0,0,0,0]},{"name":"S3 & C3","type":"double","values":[0,0.258198889747161,0,0]},{"name":"C1 & C3","type":"double","values":[0,0,0,0]},{"name":"C2 & C3","type":"double","values":[0,0,0,0]}]},"nodes":{"columns":[{"name":"code","type":"character","values":["Q1","Q2","Q3","R1","R2","R3","S1","S2","S3","C1","C2","C3"]},{"name":"MR1","type":"double","values":[-0.276343005417781,-0.276343005417782,1.15899469219902,-1.4353376976168,0,-1.2520576618794,0.00879734099386267,1.35107206893029,-1.4353376976168,0.192077376731265,0.192077376731265,-0.183280035737403]},{"name":"SVD2","type":"double","values":[0.878292052188959,0.878292052188958,1.0373804806714,-0.159088428482437,0,-0.622924181277044,-0.602676507042736,-0.0291317791659458,-0.159088428482437,-1.06651225983734,-1.06651225983734,0.463835752794606]},{"name":"SVD3","type":"double","values":[0.289225171595408,0.289225171595409,-0.273385015542626,0.562610187138035,0,3.09644026031877,-1.97872311785717,0.281721939780933,0.562610187138033,0.555106955323558,0.555106955323558,-2.53383007318073]},{"name":"SVD4","type":"double","values":[3.49488956293461e-16,3.49488956293461e-16,2.22322160681188e-16,1.27166795612273e-16,0,5.28142344672726e-16,-5.93969318174459e-16,2.93283915671815e-17,1.27166795612273e-16,-1.92993769114006e-16,-1.92993769114006e-16,-4.00975549060452e-16]},{"name":"SVD5","type":"double","values":[-2.08802882391742e-16,-2.08802882391742e-16,-2.90635571165154e-16,8.18326887734122e-17,0,-1.78873120019556e-16,4.09568212678124e-16,-1.41773167279998e-16,8.18326887734125e-17,1.48862403885156e-16,1.48862403885156e-16,2.60705808792968e-16]}]},"adjacency_key":{"columns":[{"name":"Q1 & Q2","type":"character","values":["Q1","Q2"]},{"name":"Q1 & Q3","type":"character","values":["Q1","Q3"]},{"name":"Q2 & Q3","type":"character","values":["Q2","Q3"]},{"name":"Q1 & R1","type":"character","values":["Q1","R1"]},{"name":"Q2 & R1","type":"character","values":["Q2","R1"]},{"name":"Q3 & R1","type":"character","values":["Q3","R1"]},{"name":"Q1 & R2","type":"character","values":["Q1","R2"]},{"name":"Q2 & R2","type":"character","values":["Q2","R2"]},{"name":"Q3 & R2","type":"character","values":["Q3","R2"]},{"name":"R1 & R2","type":"character","values":["R1","R2"]},{"name":"Q1 & R3","type":"character","values":["Q1","R3"]},{"name":"Q2 & R3","type":"character","values":["Q2","R3"]},{"name":"Q3 & R3","type":"character","values":["Q3","R3"]},{"name":"R1 & R3","type":"character","values":["R1","R3"]},{"name":"R2 & R3","type":"character","values":["R2","R3"]},{"name":"Q1 & S1","type":"character","values":["Q1","S1"]},{"name":"Q2 & S1","type":"character","values":["Q2","S1"]},{"name":"Q3 & S1","type":"character","values":["Q3","S1"]},{"name":"R1 & S1","type":"character","values":["R1","S1"]},{"name":"R2 & S1","type":"character","values":["R2","S1"]},{"name":"R3 & S1","type":"character","values":["R3","S1"]},{"name":"Q1 & S2","type":"character","values":["Q1","S2"]},{"name":"Q2 & S2","type":"character","values":["Q2","S2"]},{"name":"Q3 & S2","type":"character","values":["Q3","S2"]},{"name":"R1 & S2","type":"character","values":["R1","S2"]},{"name":"R2 & S2","type":"character","values":["R2","S2"]},{"name":"R3 & S2","type":"character","values":["R3","S2"]},{"name":"S1 & S2","type":"character","values":["S1","S2"]},{"name":"Q1 & S3","type":"character","values":["Q1","S3"]},{"name":"Q2 & S3","type":"character","values":["Q2","S3"]},{"name":"Q3 & S3","type":"character","values":["Q3","S3"]},{"name":"R1 & S3","type":"character","values":["R1","S3"]},{"name":"R2 & S3","type":"character","values":["R2","S3"]},{"name":"R3 & S3","type":"character","values":["R3","S3"]},{"name":"S1 & S3","type":"character","values":["S1","S3"]},{"name":"S2 & S3","type":"character","values":["S2","S3"]},{"name":"Q1 & C1","type":"character","values":["Q1","C1"]},{"name":"Q2 & C1","type":"character","values":["Q2","C1"]},{"name":"Q3 & C1","type":"character","values":["Q3","C1"]},{"name":"R1 & C1","type":"character","values":["R1","C1"]},{"name":"R2 & C1","type":"characte